{
  "id": "174aa420-19f8-419c-bedf-4c66360c9b6e",
  "name": "PSA_SAVEMORE_ESTIMATED_WORTH",
  "notes": "The persistent staging area table for the ESTIMATED WORTH data set of the SAVEMORE system.",
  "dataConnection": {
    "id": "6fe74289-e51a-42f7-85ba-3720dfdc3cda",
    "name": "PSA",
    "classifications": [
      {
        "id": "",
        "group": "Solution Area",
        "classification": "Persistent Staging Area",
        "notes": "Persistent Staging Area (PSA), immutable historized data recorded as transactions. Part of the Staging Layer."
      },
      {
        "id": "",
        "group": "Solution Layer",
        "classification": "Staging Layer",
        "notes": "Staging Layer, the ingestion layer of the data solution."
      }
    ],
    "extensions": [
      {
        "key": "location",
        "value": "dbo"
      },
      {
        "key": "connectionString",
        "value": "Data Source=.;Initial Catalog=150_Persistent_Staging_Area;Integrated Security=True;Trust Server Certificate=True;Encrypt=True;"
      },
      {
        "key": "connectionType",
        "value": "MSSQLDB"
      },
      {
        "key": "datastore",
        "value": "150_Persistent_Staging_Area"
      }
    ]
  },
  "dataItems": [
    {
      "id": "95a01001-0001-4905-892c-7e54bab2d217",
      "name": "INSCRIPTION_TIMESTAMP",
      "ordinalPosition": 1,
      "isPrimaryKey": true,
      "dataType": "datetime2",
      "numericScale": 7
    },
    {
      "id": "95a01002-0002-4133-89a9-fba4a02b3f56",
      "name": "INSCRIPTION_RECORD_ID",
      "ordinalPosition": 2,
      "isPrimaryKey": true,
      "dataType": "int"
    },
    {
      "id": "95a01003-0003-46a8-bcbf-8c8568ac0e07",
      "name": "SOURCE_TIMESTAMP",
      "ordinalPosition": 3,
      "dataType": "datetime2",
      "numericScale": 7
    },
    {
      "id": "95a01004-0004-44a8-b3d4-a8e595548393",
      "name": "CHANGE_DATA_INDICATOR",
      "ordinalPosition": 4,
      "dataType": "varchar",
      "characterLength": 100
    },
    {
      "id": "95a01005-0005-4e72-af6b-ceff0437c198",
      "name": "AUDIT_TRAIL_ID",
      "ordinalPosition": 5,
      "dataType": "int"
    },
    {
      "id": "95a01006-0006-438d-8e61-c00ab7b7e3f4",
      "name": "CHECKSUM",
      "ordinalPosition": 6,
      "dataType": "binary",
      "characterLength": 16
    },
    {
      "id": "1fff89d3-c318-4f23-a65d-ba216488f3d2",
      "name": "PLAN_CODE",
      "ordinalPosition": 7,
      "isPrimaryKey": true,
      "dataType": "nvarchar",
      "characterLength": 100
    },
    {
      "id": "948a7f71-71ac-41a4-afba-209854416804",
      "name": "DATE_EFFECTIVE",
      "ordinalPosition": 8,
      "isPrimaryKey": true,
      "dataType": "datetime2",
      "numericScale": 7
    },
    {
      "id": "4edcb3f2-0c07-437d-9ac8-7da4e7db40ab",
      "name": "VALUE_AMOUNT",
      "ordinalPosition": 9,
      "dataType": "numeric",
      "numericPrecision": 38,
      "numericScale": 20
    }
  ],
  "classifications": [
    {
      "id": "241e870d-82f1-4437-87bf-48d3e0e304cf",
      "group": "Solution Area",
      "classification": "Persistent Staging Area",
      "notes": "Persistent Staging Area (PSA), immutable historized data recorded as transactions. Part of the Staging Layer."
    },
    {
      "id": "aed7703d-ab04-4a79-ac53-5abb170c4c1b",
      "group": "Solution Layer",
      "classification": "Staging Layer",
      "notes": "Staging Layer, the ingestion layer of the data solution."
    }
  ]
}