{
  "id": "dd102082-3667-40e5-a36e-f7c5a8e91adb",
  "name": "LND_SAVEMORE_CUSTOMER_CONTACT",
  "notes": "The landing table for the CUSTOMER CONTACT data set of the SAVEMORE system.",
  "dataConnection": {
    "id": "c832ddba-3f0b-47a1-8820-02d443cfceef",
    "name": "Landing",
    "notes": "Landing area connection.",
    "classifications": [
      {
        "id": "",
        "group": "Solution Area",
        "classification": "Landing Area",
        "notes": "The landing/staging area, a transient temporary storage area to store data for downstream processing. Part of the Staging Layer."
      },
      {
        "id": "",
        "group": "Solution Layer",
        "classification": "Staging Layer",
        "notes": "Staging Layer, the ingestion layer of the data solution."
      }
    ],
    "extensions": [
      {
        "key": "location",
        "value": "dbo"
      },
      {
        "key": "connectionString",
        "value": "Data Source=.;Initial Catalog=100_Landing_Area;Integrated Security=True;Trust Server Certificate=True;Encrypt=True;"
      },
      {
        "key": "connectionType",
        "value": "MSSQLDB"
      },
      {
        "key": "datastore",
        "value": "100_Landing_Area"
      }
    ]
  },
  "dataItems": [
    {
      "id": "5e909001-0001-4905-892c-7e54bab2d217",
      "name": "INSCRIPTION_TIMESTAMP",
      "ordinalPosition": 1,
      "dataType": "datetime2",
      "numericScale": 7
    },
    {
      "id": "5e909002-0002-4133-89a9-fba4a02b3f56",
      "name": "INSCRIPTION_RECORD_ID",
      "ordinalPosition": 2,
      "dataType": "int"
    },
    {
      "id": "5e909003-0003-46a8-bcbf-8c8568ac0e07",
      "name": "SOURCE_TIMESTAMP",
      "ordinalPosition": 3,
      "dataType": "datetime2",
      "numericScale": 7
    },
    {
      "id": "5e909004-0004-44a8-b3d4-a8e595548393",
      "name": "CHANGE_DATA_INDICATOR",
      "ordinalPosition": 4,
      "dataType": "varchar",
      "characterLength": 100
    },
    {
      "id": "5e909005-0005-4e72-af6b-ceff0437c198",
      "name": "AUDIT_TRAIL_ID",
      "ordinalPosition": 5,
      "dataType": "int"
    },
    {
      "id": "5e909006-0006-438d-8e61-c00ab7b7e3f4",
      "name": "CHECKSUM",
      "ordinalPosition": 6,
      "dataType": "binary",
      "characterLength": 16
    },
    {
      "id": "b7c8d9e0-f1a2-3456-1234-789012345678",
      "name": "CUSTOMERID",
      "ordinalPosition": 7,
      "dataType": "int"
    },
    {
      "id": "d55e6116-1204-4b3f-838d-bbbc0ea70a9d",
      "name": "CONTACT_NUMBER",
      "ordinalPosition": 8,
      "dataType": "int"
    },
    {
      "id": "0a63dc8d-337f-4095-9a77-b099b1d3c749",
      "name": "VALID_FROM",
      "ordinalPosition": 9,
      "dataType": "datetime2",
      "numericScale": 7
    }
  ],
  "classifications": [
    {
      "id": "4069bbf5-10bd-4b1f-a112-8d7ebd5c97a4",
      "group": "Solution Area",
      "classification": "Landing Area",
      "notes": "The landing/staging area, a transient temporary storage area to store data for downstream processing. Part of the Staging Layer."
    },
    {
      "id": "aed7703d-ab04-4a79-ac53-5abb170c4c1b",
      "group": "Solution Layer",
      "classification": "Staging Layer",
      "notes": "Staging Layer, the ingestion layer of the data solution."
    }
  ]
}