{
  "id": "2a22eb5f-9fdc-49e0-b636-4f7daece661a",
  "name": "PSA_SAVEMORE_CUST_MEMBERSHIP",
  "notes": "The persistent staging area table for the CUST MEMBERSHIP data set of the SAVEMORE system.",
  "dataConnection": {
    "id": "6fe74289-e51a-42f7-85ba-3720dfdc3cda",
    "name": "PSA",
    "classifications": [
      {
        "id": "",
        "group": "Solution Area",
        "classification": "Persistent Staging Area",
        "notes": "Persistent Staging Area (PSA), immutable historized data recorded as transactions. Part of the Staging Layer."
      },
      {
        "id": "",
        "group": "Solution Layer",
        "classification": "Staging Layer",
        "notes": "Staging Layer, the ingestion layer of the data solution."
      }
    ],
    "extensions": [
      {
        "key": "location",
        "value": "dbo"
      },
      {
        "key": "connectionString",
        "value": "Data Source=.;Initial Catalog=150_Persistent_Staging_Area;Integrated Security=True;Trust Server Certificate=True;Encrypt=True;"
      },
      {
        "key": "connectionType",
        "value": "MSSQLDB"
      },
      {
        "key": "datastore",
        "value": "150_Persistent_Staging_Area"
      }
    ]
  },
  "dataItems": [
    {
      "id": "95a07001-0001-4905-892c-7e54bab2d217",
      "name": "INSCRIPTION_TIMESTAMP",
      "ordinalPosition": 1,
      "isPrimaryKey": true,
      "dataType": "datetime2",
      "numericScale": 7
    },
    {
      "id": "95a07002-0002-4133-89a9-fba4a02b3f56",
      "name": "INSCRIPTION_RECORD_ID",
      "ordinalPosition": 2,
      "isPrimaryKey": true,
      "dataType": "int"
    },
    {
      "id": "95a07003-0003-46a8-bcbf-8c8568ac0e07",
      "name": "SOURCE_TIMESTAMP",
      "ordinalPosition": 3,
      "dataType": "datetime2",
      "numericScale": 7
    },
    {
      "id": "95a07004-0004-44a8-b3d4-a8e595548393",
      "name": "CHANGE_DATA_INDICATOR",
      "ordinalPosition": 4,
      "dataType": "varchar",
      "characterLength": 100
    },
    {
      "id": "95a07005-0005-4e72-af6b-ceff0437c198",
      "name": "AUDIT_TRAIL_ID",
      "ordinalPosition": 5,
      "dataType": "int"
    },
    {
      "id": "95a07006-0006-438d-8e61-c00ab7b7e3f4",
      "name": "CHECKSUM",
      "ordinalPosition": 6,
      "dataType": "binary",
      "characterLength": 16
    },
    {
      "id": "e4f5a6b7-c8d9-0123-ef01-456789012345",
      "name": "CUSTOMERID",
      "ordinalPosition": 7,
      "isPrimaryKey": true,
      "dataType": "int"
    },
    {
      "id": "3a5c0af5-d37f-4203-badc-198e36c20a93",
      "name": "PLAN_CODE",
      "ordinalPosition": 8,
      "isPrimaryKey": true,
      "dataType": "nvarchar",
      "characterLength": 100
    },
    {
      "id": "e621ebe7-06d1-4ff2-9940-e0c7faf2811e",
      "name": "START_DATE",
      "ordinalPosition": 9,
      "dataType": "datetime2",
      "numericScale": 7
    },
    {
      "id": "3994f681-8242-411a-81a7-aa12ac075edf",
      "name": "END_DATE",
      "ordinalPosition": 10,
      "dataType": "datetime2",
      "numericScale": 7
    },
    {
      "id": "0b616ec6-b318-412d-8e4b-d5bbeb6e0673",
      "name": "STATUS",
      "ordinalPosition": 11,
      "dataType": "nvarchar",
      "characterLength": 100
    },
    {
      "id": "ce763a34-dae0-47f0-807f-c8a6d827e3c7",
      "name": "COMMENT",
      "ordinalPosition": 12,
      "dataType": "nvarchar",
      "characterLength": 100
    }
  ],
  "classifications": [
    {
      "id": "241e870d-82f1-4437-87bf-48d3e0e304cf",
      "group": "Solution Area",
      "classification": "Persistent Staging Area",
      "notes": "Persistent Staging Area (PSA), immutable historized data recorded as transactions. Part of the Staging Layer."
    },
    {
      "id": "aed7703d-ab04-4a79-ac53-5abb170c4c1b",
      "group": "Solution Layer",
      "classification": "Staging Layer",
      "notes": "Staging Layer, the ingestion layer of the data solution."
    }
  ]
}