{
  "id": "d00abec5-73cf-4724-b22b-8253c1fd1c1e",
  "name": "Data Property",
  "notes": "Data property with classifications for data storage and physical model and controls/rules.",
  "dataConnection": {
    "id": "48b83b6e-4021-4552-98d4-768e873807af",
    "name": "Sandbox",
    "extensions": [
      {
        "key": "location",
        "value": "dbo"
      },
      {
        "key": "connectionString",
        "value": "Data Source=.;Initial Catalog=Sandbox;Integrated Security=True;Trust Server Certificate=True;Encrypt=True;"
      },
      {
        "key": "connectionType",
        "value": "MSSQLDB"
      },
      {
        "key": "datastore",
        "value": "Sandbox"
      }
    ]
  },
  "dataItems": [
    {
      "id": "10b52b98-16aa-43d9-8411-7cf81cc34f83",
      "name": "Data Quality Control",
      "ordinalPosition": 1,
      "dataType": "nvarchar",
      "characterLength": 4000
    },
    {
      "id": "4c8650b0-0a70-4df6-bd4e-06bbe4945aae",
      "name": "Business Rules",
      "ordinalPosition": 2,
      "dataType": "nvarchar",
      "characterLength": 4000
    }
  ],
  "classifications": [
    {
      "id": "88cd4df8-1452-4ef0-9f66-95bd302e85f2",
      "group": "Model Layer",
      "classification": "Data Platform",
      "notes": "Classification for data storage and related groups."
    },
    {
      "id": "92f903f9-16fb-497e-aba4-cec656f7a1ab",
      "group": "Model Layer",
      "classification": "Physical Model",
      "notes": "Classification for physical data models or modelings."
    }
  ]
}