{
  "id": "59473d34-a39f-46c3-a6e0-882af5266449",
  "name": "Business Process L1",
  "notes": "Business process L1 with Process Management (BPMN) classification and core process fields.",
  "dataConnection": {
    "id": "48b83b6e-4021-4552-98d4-768e873807af",
    "name": "Sandbox",
    "extensions": [
      {
        "key": "location",
        "value": "dbo"
      },
      {
        "key": "connectionString",
        "value": "Data Source=.;Initial Catalog=Sandbox;Integrated Security=True;Trust Server Certificate=True;Encrypt=True;"
      },
      {
        "key": "connectionType",
        "value": "MSSQLDB"
      },
      {
        "key": "datastore",
        "value": "Sandbox"
      }
    ]
  },
  "dataItems": [
    {
      "id": "d7bbc6dc-8dde-443e-b477-f551b76ddb3e",
      "name": "Process Goal",
      "ordinalPosition": 1,
      "dataType": "nvarchar",
      "characterLength": 4000
    },
    {
      "id": "1f3a3173-9da1-44e2-8e9f-c235e1407ed2",
      "name": "Process Description",
      "ordinalPosition": 2,
      "dataType": "nvarchar",
      "characterLength": 4000
    },
    {
      "id": "53c764d0-d984-46b7-be60-81a9e74f54d6",
      "name": "Process Documentation",
      "ordinalPosition": 3,
      "dataType": "nvarchar",
      "characterLength": 4000
    }
  ],
  "classifications": [
    {
      "id": "20a6572a-bfa4-4091-8fcd-eeedb37d5ee5",
      "group": "Model Layer",
      "classification": "Process Management (BPMN)",
      "notes": "Classification for business processes (L1-L5) within Process Management (BPMN)."
    },
    {
      "id": "a814275d-3149-4bd2-ab6b-e95e34e725b4",
      "group": "System of Reference",
      "classification": "Enterprise Architecture"
    },
    {
      "id": "5e67e1ff-0294-498b-b0e8-dba6b6d9176e",
      "group": "System of Record",
      "classification": "Enterprise Architecture"
    }
  ]
}