{
  "id": "6fe74289-e51a-42f7-85ba-3720dfdc3cda",
  "name": "PSA",
  "classifications": [
    {
      "id": "",
      "group": "Solution Area",
      "classification": "Persistent Staging Area",
      "notes": "Persistent Staging Area (PSA), immutable historized data recorded as transactions. Part of the Staging Layer."
    },
    {
      "id": "",
      "group": "Solution Layer",
      "classification": "Staging Layer",
      "notes": "Staging Layer, the ingestion layer of the data solution."
    }
  ],
  "extensions": [
    {
      "key": "location",
      "value": "dbo"
    },
    {
      "key": "connectionString",
      "value": "Data Source=.;Initial Catalog=150_Persistent_Staging_Area;Integrated Security=True;Trust Server Certificate=True;Encrypt=True;"
    },
    {
      "key": "connectionType",
      "value": "MSSQLDB"
    },
    {
      "key": "datastore",
      "value": "150_Persistent_Staging_Area"
    }
  ]
}