{
  "id": "1412db6b-1f32-43a1-bf60-323dca781759",
  "name": "Document Type",
  "notes": "Document type with type description.",
  "dataConnection": {
    "id": "48b83b6e-4021-4552-98d4-768e873807af",
    "name": "Sandbox",
    "extensions": [
      {
        "key": "location",
        "value": "dbo"
      },
      {
        "key": "connectionString",
        "value": "Data Source=.;Initial Catalog=Sandbox;Integrated Security=True;Trust Server Certificate=True;Encrypt=True;"
      },
      {
        "key": "connectionType",
        "value": "MSSQLDB"
      },
      {
        "key": "datastore",
        "value": "Sandbox"
      }
    ]
  },
  "dataItems": [
    {
      "id": "3eca2858-8971-42ec-85ca-ed24b5d9fa91",
      "name": "Type",
      "ordinalPosition": 1,
      "dataType": "nvarchar",
      "characterLength": 4000
    }
  ],
  "classifications": [
    {
      "id": "dac5e9fe-8367-4a61-b8ae-9817c24293ac",
      "group": "Model Layer",
      "classification": "Documents",
      "notes": "Classification for documents published in a document store."
    }
  ]
}