{
  "id": "c25f3e2c-1e45-4d01-818d-2b1c3bb3ad77",
  "name": "LND_SAVEMORE_CUSTOMER_PERSONAL",
  "notes": "The landing table for the CUSTOMER PERSONAL data set of the SAVEMORE system.",
  "dataConnection": {
    "id": "c832ddba-3f0b-47a1-8820-02d443cfceef",
    "name": "Landing",
    "notes": "Landing area connection.",
    "classifications": [
      {
        "id": "",
        "group": "Solution Area",
        "classification": "Landing Area",
        "notes": "The landing/staging area, a transient temporary storage area to store data for downstream processing. Part of the Staging Layer."
      },
      {
        "id": "",
        "group": "Solution Layer",
        "classification": "Staging Layer",
        "notes": "Staging Layer, the ingestion layer of the data solution."
      }
    ],
    "extensions": [
      {
        "key": "location",
        "value": "dbo"
      },
      {
        "key": "connectionString",
        "value": "Data Source=.;Initial Catalog=100_Landing_Area;Integrated Security=True;Trust Server Certificate=True;Encrypt=True;"
      },
      {
        "key": "connectionType",
        "value": "MSSQLDB"
      },
      {
        "key": "datastore",
        "value": "100_Landing_Area"
      }
    ]
  },
  "dataItems": [
    {
      "id": "5e908001-0001-4905-892c-7e54bab2d217",
      "name": "INSCRIPTION_TIMESTAMP",
      "ordinalPosition": 1,
      "dataType": "datetime2",
      "numericScale": 7
    },
    {
      "id": "5e908002-0002-4133-89a9-fba4a02b3f56",
      "name": "INSCRIPTION_RECORD_ID",
      "ordinalPosition": 2,
      "dataType": "int"
    },
    {
      "id": "5e908003-0003-46a8-bcbf-8c8568ac0e07",
      "name": "SOURCE_TIMESTAMP",
      "ordinalPosition": 3,
      "dataType": "datetime2",
      "numericScale": 7
    },
    {
      "id": "5e908004-0004-44a8-b3d4-a8e595548393",
      "name": "CHANGE_DATA_INDICATOR",
      "ordinalPosition": 4,
      "dataType": "varchar",
      "characterLength": 100
    },
    {
      "id": "5e908005-0005-4e72-af6b-ceff0437c198",
      "name": "AUDIT_TRAIL_ID",
      "ordinalPosition": 5,
      "dataType": "int"
    },
    {
      "id": "5e908006-0006-438d-8e61-c00ab7b7e3f4",
      "name": "CHECKSUM",
      "ordinalPosition": 6,
      "dataType": "binary",
      "characterLength": 16
    },
    {
      "id": "f5a6b7c8-d9e0-1234-f012-567890123456",
      "name": "CUSTOMERID",
      "ordinalPosition": 7,
      "dataType": "int"
    },
    {
      "id": "a29c8f65-e0a1-4c68-b32a-80a08c8dbeb3",
      "name": "GIVEN",
      "ordinalPosition": 8,
      "dataType": "nvarchar",
      "characterLength": 100
    },
    {
      "id": "9e45ceb3-085c-4055-83ce-301848e571fa",
      "name": "SURNAME",
      "ordinalPosition": 9,
      "dataType": "nvarchar",
      "characterLength": 100
    },
    {
      "id": "045a95e9-2f39-4052-84ab-a62b99c15390",
      "name": "SUBURB",
      "ordinalPosition": 10,
      "dataType": "nvarchar",
      "characterLength": 100
    },
    {
      "id": "ea8548d3-5ccb-4d04-9c05-a0733094a398",
      "name": "STATE",
      "ordinalPosition": 11,
      "dataType": "nvarchar",
      "characterLength": 100
    },
    {
      "id": "de3ad293-b078-4718-8013-1c0bf8b3c6a8",
      "name": "POSTCODE",
      "ordinalPosition": 12,
      "dataType": "nvarchar",
      "characterLength": 100
    },
    {
      "id": "6edd253f-94ad-4f03-8335-b1317b6c7563",
      "name": "COUNTRY",
      "ordinalPosition": 13,
      "dataType": "nvarchar",
      "characterLength": 100
    },
    {
      "id": "a4f2e081-2054-4dac-bf54-e28fdb386807",
      "name": "PRONOUN",
      "ordinalPosition": 14,
      "dataType": "nvarchar",
      "characterLength": 100
    },
    {
      "id": "823305d0-197a-4bff-8053-443875d988fc",
      "name": "DOB",
      "ordinalPosition": 15,
      "dataType": "datetime2",
      "numericScale": 7
    },
    {
      "id": "ed4a135e-81b1-41fa-8c85-a389ae25d5c7",
      "name": "REFEREE_OFFER_MADE",
      "ordinalPosition": 16,
      "dataType": "int"
    },
    {
      "id": "8a6d7b77-00fa-421b-b0d7-236a8ae918da",
      "name": "VALID_FROM",
      "ordinalPosition": 17,
      "dataType": "datetime2",
      "numericScale": 7
    }
  ],
  "classifications": [
    {
      "id": "4069bbf5-10bd-4b1f-a112-8d7ebd5c97a4",
      "group": "Solution Area",
      "classification": "Landing Area",
      "notes": "The landing/staging area, a transient temporary storage area to store data for downstream processing. Part of the Staging Layer."
    },
    {
      "id": "aed7703d-ab04-4a79-ac53-5abb170c4c1b",
      "group": "Solution Layer",
      "classification": "Staging Layer",
      "notes": "Staging Layer, the ingestion layer of the data solution."
    }
  ]
}