{
  "id": "1ba0099f-23f6-4cbb-ae06-7d1cb7b4e713",
  "name": "CUSTOMER_OFFER",
  "notes": "A customer can only have one active offer at a time.",
  "dataConnection": {
    "id": "b9afa559-3a59-4404-ae0f-0c33ef9c7515",
    "name": "Source",
    "classifications": [
      {
        "id": "",
        "group": "Solution Layer",
        "classification": "Operational System",
        "notes": "\u0027Source\u0027 layer, representing the operational systems or interfaces that provide data to the solution."
      }
    ],
    "extensions": [
      {
        "key": "location",
        "value": "dbo"
      },
      {
        "key": "connectionString",
        "value": "Data Source=.;Initial Catalog=000_Source;Integrated Security=True;Trust Server Certificate=True"
      },
      {
        "key": "connectionType",
        "value": "MSSQLDB"
      },
      {
        "key": "datastore",
        "value": "000_Source"
      }
    ]
  },
  "dataItems": [
    {
      "id": "a1111111-1111-1111-1111-111111111111",
      "name": "CustomerID",
      "ordinalPosition": 1,
      "isPrimaryKey": true,
      "dataType": "int"
    },
    {
      "id": "ec29c189-4208-47cc-b11f-b2a3591a7d83",
      "name": "OfferID",
      "ordinalPosition": 2,
      "isPrimaryKey": true,
      "dataType": "int"
    }
  ],
  "classifications": [
    {
      "id": "3cb478a3-f7cb-436d-8cba-171988808add",
      "group": "Solution Layer",
      "classification": "Operational System",
      "notes": "\u0027Source\u0027 layer, representing the operational systems or interfaces that provide data to the solution."
    },
    {
      "id": "43b6ce73-62ba-43a5-a330-3bf9440599e4",
      "group": "Solution Area",
      "classification": "Operational System"
    }
  ],
  "extensions": [
    {
      "key": "originatingSystem",
      "value": "SAVEMORE",
      "notes": "SaveMore source system"
    }
  ],
  "templateMappings": [
    {
      "templateFileName": "/DataObjects/SourceSqlServerGenerateTable.handlebars"
    },
    {
      "templateFileName": "/DataObjects/LandingSqlServerGenerateTable.handlebars"
    },
    {
      "templateFileName": "/DataObjects/PersistentStagingSqlServerGenerateTable.handlebars"
    }
  ]
}