{
  "id": "baa8d4e6-54ab-41f7-a632-cccc6b3fd76f",
  "name": "Data Set",
  "notes": "Dataset of a data product. This specifically concerns the metadata of the data product and not the physical data, which is always stored elsewhere, not in the marketplace.",
  "dataConnection": {
    "id": "48b83b6e-4021-4552-98d4-768e873807af",
    "name": "Sandbox",
    "extensions": [
      {
        "key": "location",
        "value": "dbo"
      },
      {
        "key": "connectionString",
        "value": "Data Source=.;Initial Catalog=Sandbox;Integrated Security=True;Trust Server Certificate=True;Encrypt=True;"
      },
      {
        "key": "connectionType",
        "value": "MSSQLDB"
      },
      {
        "key": "datastore",
        "value": "Sandbox"
      }
    ]
  },
  "dataItems": [
    {
      "id": "684790d8-2ab7-4ea9-aba5-14f7d2b581bd",
      "name": "Type",
      "ordinalPosition": 1,
      "dataType": "nvarchar",
      "characterLength": 4000
    },
    {
      "id": "00f48372-ba6e-41a6-b9e6-bccb66e9c259",
      "name": "Description",
      "ordinalPosition": 2,
      "dataType": "nvarchar",
      "characterLength": 4000
    },
    {
      "id": "56572eae-e53a-4cd0-90eb-85e10ee0e811",
      "name": "Purpose",
      "ordinalPosition": 3,
      "dataType": "nvarchar",
      "characterLength": 4000
    },
    {
      "id": "1bf9a6c2-0538-4807-82c1-786835e1b883",
      "name": "Target Audience",
      "ordinalPosition": 4,
      "dataType": "nvarchar",
      "characterLength": 4000
    },
    {
      "id": "222d513d-0365-4e24-bce3-06232c122628",
      "name": "Rating",
      "ordinalPosition": 5,
      "dataType": "nvarchar",
      "characterLength": 4000
    }
  ],
  "classifications": [
    {
      "id": "ee152a7e-51ff-43d9-b060-3275f03f0764",
      "group": "Model Layer",
      "classification": "Data Marketplace",
      "notes": "Classification for data products published via a data marketplace."
    }
  ]
}