{
  "id": "3fef72bb-1e2a-4ffe-8cd3-f2b53bbc0d5a",
  "name": "Document Store",
  "notes": "Document stores where documents with associated metadata are stored.",
  "dataConnection": {
    "id": "48b83b6e-4021-4552-98d4-768e873807af",
    "name": "Sandbox",
    "extensions": [
      {
        "key": "location",
        "value": "dbo"
      },
      {
        "key": "connectionString",
        "value": "Data Source=.;Initial Catalog=Sandbox;Integrated Security=True;Trust Server Certificate=True;Encrypt=True;"
      },
      {
        "key": "connectionType",
        "value": "MSSQLDB"
      },
      {
        "key": "datastore",
        "value": "Sandbox"
      }
    ]
  },
  "dataItems": [
    {
      "id": "10f111b4-4783-47b4-8e84-b136929c7f6b",
      "name": "Owner",
      "ordinalPosition": 1,
      "dataType": "nvarchar",
      "characterLength": 4000
    }
  ],
  "classifications": [
    {
      "id": "dac5e9fe-8367-4a61-b8ae-9817c24293ac",
      "group": "Model Layer",
      "classification": "Documents",
      "notes": "Classification for documents published in a document store."
    }
  ]
}