{
  "id": "0236d840-3a49-44f0-9686-d5db21b34a7c",
  "name": "Application Interface",
  "notes": "Application interface with application classification.",
  "dataConnection": {
    "id": "48b83b6e-4021-4552-98d4-768e873807af",
    "name": "Sandbox",
    "extensions": [
      {
        "key": "location",
        "value": "dbo"
      },
      {
        "key": "connectionString",
        "value": "Data Source=.;Initial Catalog=Sandbox;Integrated Security=True;Trust Server Certificate=True;Encrypt=True;"
      },
      {
        "key": "connectionType",
        "value": "MSSQLDB"
      },
      {
        "key": "datastore",
        "value": "Sandbox"
      }
    ]
  },
  "dataItems": [],
  "classifications": [
    {
      "id": "9043bcbd-5696-4488-9ac9-e7dc601e713d",
      "group": "Model Layer",
      "classification": "Application",
      "notes": "Classification for applications, components, functions and interfaces."
    },
    {
      "id": "5e67e1ff-0294-498b-b0e8-dba6b6d9176e",
      "group": "System of Record",
      "classification": "Enterprise Architecture"
    },
    {
      "id": "22f4205b-371a-493d-9f9c-7e5a9cf2060f",
      "group": "System of Reference",
      "classification": "Data Dictionary"
    }
  ]
}