{
  "id": "622f5af9-2f59-42a0-99aa-4f8815ed7f8e",
  "name": "Document",
  "notes": "Documents stored in a document store with matching metadata.",
  "dataConnection": {
    "id": "48b83b6e-4021-4552-98d4-768e873807af",
    "name": "Sandbox",
    "extensions": [
      {
        "key": "location",
        "value": "dbo"
      },
      {
        "key": "connectionString",
        "value": "Data Source=.;Initial Catalog=Sandbox;Integrated Security=True;Trust Server Certificate=True;Encrypt=True;"
      },
      {
        "key": "connectionType",
        "value": "MSSQLDB"
      },
      {
        "key": "datastore",
        "value": "Sandbox"
      }
    ]
  },
  "dataItems": [
    {
      "id": "ee86cd77-a0e4-4c5c-8b22-04ffe2bec506",
      "name": "Owner",
      "ordinalPosition": 1,
      "dataType": "nvarchar",
      "characterLength": 4000
    },
    {
      "id": "22bcf7aa-351e-4d45-897e-fd1620727f56",
      "name": "Description",
      "ordinalPosition": 2,
      "dataType": "nvarchar",
      "characterLength": 4000
    },
    {
      "id": "5f096da0-ab92-4579-a80c-e04f2fc50c44",
      "name": "Mandatory Tag",
      "ordinalPosition": 3,
      "dataType": "nvarchar",
      "characterLength": 4000
    },
    {
      "id": "caca3141-4cb2-46fe-ad76-b90009d8d07d",
      "name": "Optional Tag",
      "ordinalPosition": 4,
      "dataType": "nvarchar",
      "characterLength": 4000
    },
    {
      "id": "e30a3178-e5cb-4440-a550-b1e207d25544",
      "name": "Keyword",
      "ordinalPosition": 5,
      "dataType": "nvarchar",
      "characterLength": 4000
    }
  ],
  "classifications": [
    {
      "id": "dac5e9fe-8367-4a61-b8ae-9817c24293ac",
      "group": "Model Layer",
      "classification": "Documents",
      "notes": "Classification for documents published in a document store."
    }
  ]
}