{
  "id": "b6b24724-1e9f-41b0-8dd8-e9ecfca3ee1e",
  "name": "Business Process L3",
  "notes": "Business process L3 with Process Management (BPMN) classification and role, purpose and documentation fields.",
  "dataConnection": {
    "id": "48b83b6e-4021-4552-98d4-768e873807af",
    "name": "Sandbox",
    "extensions": [
      {
        "key": "location",
        "value": "dbo"
      },
      {
        "key": "connectionString",
        "value": "Data Source=.;Initial Catalog=Sandbox;Integrated Security=True;Trust Server Certificate=True;Encrypt=True;"
      },
      {
        "key": "connectionType",
        "value": "MSSQLDB"
      },
      {
        "key": "datastore",
        "value": "Sandbox"
      }
    ]
  },
  "dataItems": [
    {
      "id": "c062e9f1-b2f0-4c57-90f3-f1f77e1b2700",
      "name": "Business Role",
      "ordinalPosition": 1,
      "dataType": "nvarchar",
      "characterLength": 4000
    },
    {
      "id": "1a03f63c-4bbc-4615-a045-5ded7e8c7e49",
      "name": "Business Actor",
      "ordinalPosition": 2,
      "dataType": "nvarchar",
      "characterLength": 4000
    },
    {
      "id": "ed51cd72-09ee-404e-a1ad-b477a4571646",
      "name": "Process Goal",
      "ordinalPosition": 3,
      "dataType": "nvarchar",
      "characterLength": 4000
    },
    {
      "id": "e28e5d9d-2167-4bb5-9fd3-b882a02d524a",
      "name": "Process Description",
      "ordinalPosition": 4,
      "dataType": "nvarchar",
      "characterLength": 4000
    },
    {
      "id": "53dd07be-8f40-415b-8d08-3a596896b3dc",
      "name": "Process Documentation",
      "ordinalPosition": 5,
      "dataType": "nvarchar",
      "characterLength": 4000
    }
  ],
  "classifications": [
    {
      "id": "20a6572a-bfa4-4091-8fcd-eeedb37d5ee5",
      "group": "Model Layer",
      "classification": "Process Management (BPMN)",
      "notes": "Classification for business processes (L1-L5) within Process Management (BPMN)."
    },
    {
      "id": "5e67e1ff-0294-498b-b0e8-dba6b6d9176e",
      "group": "System of Record",
      "classification": "Enterprise Architecture"
    },
    {
      "id": "a814275d-3149-4bd2-ab6b-e95e34e725b4",
      "group": "System of Reference",
      "classification": "Enterprise Architecture"
    }
  ]
}